<?xml version="1.0" encoding="UTF-8"?>
<heladería xmlns:xsi="http://www.w3.org/2001/XMLSchema-instance" xsi:noNamespaceSchemaLocation="heladeria.xsd">
  <helado fecha-fabricación="2015-01-30">
    <chocolate>250</chocolate>
    <mango>300</mango>
  </helado>
  <helado fecha-fabricación="2015-01-30">
    <fresa>500</fresa>
    <vainilla>200</vainilla>
    <apto-para-celíacos/>
  </helado>
</heladería>